{
  "$schema": "http://json-schema.org/draft-07/schema#",
  "$id": "https://github.com/nerymurillohnd/claude-essentials/schemas/plugin.schema.json",
  "title": "Claude Code plugin.json",
  "description": "Schema for a plugin's .claude-plugin/plugin.json manifest. Field set follows https://code.claude.com/docs/en/plugins-reference.md — intentionally covers only fields this marketplace's tooling relies on; unknown extra fields are tolerated for forward-compatibility.",
  "type": "object",
  "additionalProperties": true,
  "required": ["name", "description", "version"],
  "properties": {
    "name": {
      "type": "string",
      "pattern": "^[a-z0-9]+(-[a-z0-9]+)*$",
      "maxLength": 42,
      "description": "Unique kebab-case identifier, matches the plugin's directory name. Max 42 characters so the derived GitHub label \"plugin: <name>\" stays within GitHub's 50-character limit (ADR-0004)."
    },
    "displayName": { "type": "string" },
    "version": {
      "type": "string",
      "pattern": "^(0|[1-9]\\d*)\\.(0|[1-9]\\d*)\\.(0|[1-9]\\d*)(-((0|[1-9]\\d*|\\d*[a-zA-Z-][0-9a-zA-Z-]*)(\\.(0|[1-9]\\d*|\\d*[a-zA-Z-][0-9a-zA-Z-]*))*))?$",
      "description": "Required by this repo (ADR-0003): explicit semver without build metadata. Bump on every user-facing change; CI tags {name}--v{version} on merge."
    },
    "description": {
      "type": "string",
      "description": "Required by this repo's own convention (stricter than upstream) so the generated marketplace catalog always has a description."
    },
    "author": {
      "type": "object",
      "additionalProperties": false,
      "required": ["name"],
      "properties": {
        "name": { "type": "string" },
        "email": { "type": "string", "format": "email" },
        "url": { "type": "string", "format": "uri" }
      }
    },
    "homepage": { "type": "string", "format": "uri" },
    "repository": { "type": "string" },
    "license": { "type": "string" },
    "keywords": {
      "type": "array",
      "items": { "type": "string" }
    },
    "commands": {
      "anyOf": [{ "type": "string" }, { "type": "array", "items": { "type": "string" } }]
    },
    "agents": {
      "anyOf": [{ "type": "string" }, { "type": "array", "items": { "type": "string" } }]
    },
    "skills": {
      "anyOf": [{ "type": "string" }, { "type": "array", "items": { "type": "string" } }]
    },
    "hooks": {},
    "mcpServers": {},
    "dependencies": {
      "type": "array",
      "items": { "type": "string" }
    }
  }
}
